{
  "_meta": {
    "model": "Pocket Cinema Camera 6K Pro",
    "model_key": "POCKET_6K_PRO",
    "firmware": "v8.6",
    "ble_name": "A:026881AD",
    "status": "UNVERIFIED"
  },
  "ble": {
    "incoming_property": "indicate",
    "_comment": "Add characteristic_incoming only to override the default INCOMING_CONTROL UUID in constants.py"
  },
  "gap_meta_data": {
    "readable": true
  },
  "device_info_meta_data": {
    "readable": true
  },
  "commands": {
    "recording": {
      "category": 10,
      "parameter": 1,
      "data_type": "INT8",
      "reserved": 1,
      "values": {
        "start": 2,
        "stop": 0
      },
      "provenance": {
        "status": "VERIFIED",
        "method": "guided-discovery (tools/control/discover_command.py)",
        "capture_refs": [
          "C:\\Users\\7401378\\Desktop\\6K_G2\\bm-ble-framework\\tools\\captures\\POCKET_6K_PRO_v8.6\\POCKET_6K_PRO_v8.6_20260708T153127.json"
        ],
        "verified_on": "2026-07-08",
        "notes": "Operator-confirmed outcomes: start, stop. 2026-07-09: data_type relabelled BOOL -> INT8 when DataType was remapped to the official spec coding; the captured wire byte (0x01) is unchanged."
      },
      "echo_operation": 2
    }
  }
}
